{"channels":[{"binary_like":true,"group":"context","hi":1.0,"id":"aimp","lo":0.0,"train_max":1.0,"train_mean":0.010102000087499619,"train_min":0.0,"train_std":0.09999974817037582},{"binary_like":false,"group":"context","hi":37.0,"id":"amud","lo":-47.0,"train_max":30.0,"train_mean":-2.8640809059143066,"train_min":-37.0,"train_std":9.831501960754395},{"binary_like":false,"group":"context","hi":50.0,"id":"arnd","lo":10.0,"train_max":50.0,"train_mean":21.574430465698242,"train_min":10.0,"train_std":10.634468078613281},{"binary_like":false,"group":"context","hi":1.0,"id":"asin1","lo":-1.0,"train_max":1.0,"train_mean":0.029595445841550827,"train_min":-1.0,"train_std":0.6998640894889832},{"binary_like":false,"group":"context","hi":1.0,"id":"asin2","lo":-1.0,"train_max":1.0,"train_mean":0.002564498921856284,"train_min":-1.0,"train_std":0.7078535556793213},{"binary_like":true,"group":"context","hi":1.0,"id":"adbr","lo":0.0,"train_max":1.0,"train_mean":0.4985400140285492,"train_min":0.0,"train_std":0.4999977946281433},{"binary_like":true,"group":"context","hi":1.0,"id":"adfl","lo":0.0,"train_max":1.0,"train_mean":0.6034500002861023,"train_min":0.0,"train_std":0.4891810417175293},{"binary_like":false,"group":"telemetry","hi":16.77479362487793,"id":"bed1","lo":-8.488070487976074,"train_max":6.068268775939941,"train_mean":1.0101847648620605,"train_min":0.0,"train_std":0.7102624773979187},{"binary_like":false,"group":"telemetry","hi":10.149064064025879,"id":"bed2","lo":-4.6753458976745605,"train_max":3.468064308166504,"train_mean":0.20204000174999237,"train_min":0.0,"train_std":0.3214535713195801},{"binary_like":false,"group":"telemetry","hi":780.3936157226562,"id":"bfo1","lo":-117.55878448486328,"train_max":49.36894226074219,"train_mean":10.929098129272461,"train_min":0.0,"train_std":11.343477249145508},{"binary_like":false,"group":"telemetry","hi":1306.2567138671875,"id":"bfo2","lo":-172.09375,"train_max":78.07527923583984,"train_mean":45.462345123291016,"train_min":0.0,"train_std":11.997133255004883},{"binary_like":false,"group":"telemetry","hi":129.02537536621094,"id":"bso1","lo":-89.5602798461914,"train_max":31.074949264526367,"train_mean":-2.8611040115356445,"train_min":-37.91830062866211,"train_std":9.879521369934082},{"binary_like":false,"group":"telemetry","hi":34.513702392578125,"id":"bso2","lo":-11.261865615844727,"train_max":1.9134204387664795,"train_mean":0.6034505367279053,"train_min":-0.7458815574645996,"train_std":0.6840662956237793},{"binary_like":false,"group":"telemetry","hi":8.804987907409668,"id":"bso3","lo":-1.4568825960159302,"train_max":0.59080570936203,"train_mean":0.3004404902458191,"train_min":0.0,"train_std":0.0981762707233429},{"binary_like":false,"group":"telemetry","hi":6354.1982421875,"id":"ced1","lo":-808.0387573242188,"train_max":1107.280517578125,"train_mean":383.5187072753906,"train_min":0.0,"train_std":137.64138793945312},{"binary_like":false,"group":"telemetry","hi":127.56649780273438,"id":"cfo1","lo":-156.03713989257812,"train_max":32.293983459472656,"train_mean":-10.785074234008789,"train_min":-72.23774719238281,"train_std":14.315481185913086},{"binary_like":false,"group":"telemetry","hi":296.1995544433594,"id":"cso1","lo":-203.03143310546875,"train_max":87.93220520019531,"train_mean":43.20093536376953,"train_min":-20.445898056030273,"train_std":15.719284057617188}],"grouping_note":"aimp amud arnd asin1 asin2 adbr adfl are 4 control commands and 3 external stimuli per the dataset document; the document's name-to-role figure was not machine-readable, so they are grouped as context without assigning roles.","schema_version":"v1","tags":{"channels":"SYNTHETIC"}}
